{
  "name": "🏈10 FOR $10❌",
  "display_name": "🏈10 FOR $10❌",
  "sport": "nfl",
  "platform": "sleeper",
  "invite_url": "http://sleeper.com/i/kMgwLBWeYeXdk",
  "generated_at": "2026-09-19T16:50:00.000Z",
  "generated_by": "brand-name-fix",
  "commissioner": {
    "display_name": "allsxxing",
    "user_id": "1058575263971250176",
    "team_name": "A$H & TETTIES",
    "real_name": "GJ Bordallo",
    "handle": "@allsxxing"
  },
  "season_chain": [
    {
      "season": "2024",
      "league_id": "1131889650307706880",
      "status": "complete",
      "source": "previous_league_id (confirm via sync-sleeper.mjs)"
    },
    {
      "season": "2025",
      "league_id": "1214028632419217409",
      "draft_id": "1214028632431808512",
      "status": "complete",
      "latest_league_winner_roster_id": "10"
    },
    {
      "season": "2026",
      "league_id": "1370188155843526656",
      "status": "in_season"
    }
  ],
  "settings": {
    "num_teams": 10,
    "type": "redraft",
    "best_ball": false,
    "playoff_teams": 6,
    "playoff_week_start": 15,
    "trade_deadline_week": 12,
    "trade_review_days": 2,
    "waiver_type": "faab",
    "waiver_budget_faab": 200,
    "waiver_day_of_week": 2,
    "max_keepers": 1,
    "veto_votes_needed": 5,
    "reserve_slots": 3,
    "max_subs": 3,
    "roster_positions": [
      "QB",
      "RB",
      "RB",
      "WR",
      "WR",
      "TE",
      "FLEX",
      "FLEX",
      "FLEX",
      "K",
      "DEF",
      "BN",
      "BN",
      "BN",
      "BN",
      "BN",
      "BN",
      "BN"
    ]
  },
  "scoring_settings": {
    "sack": 1,
    "fgm_40_49": 4,
    "pass_int": -1,
    "pts_allow_0": 10,
    "pass_2pt": 2,
    "st_td": 6,
    "rec_td": 6,
    "fgm_30_39": 3,
    "fgm_50_59": 5,
    "xpmiss": -1,
    "rush_td": 6,
    "rec_2pt": 2,
    "st_fum_rec": 1,
    "fgmiss": -1,
    "ff": 1,
    "rec": 1,
    "pts_allow_14_20": 1,
    "fgm_0_19": 3,
    "int": 2,
    "def_st_fum_rec": 1,
    "fum_lost": -2,
    "pts_allow_1_6": 7,
    "fgm_60p": 6,
    "fgm_20_29": 3,
    "pts_allow_21_27": 0,
    "xpm": 1,
    "rush_2pt": 2,
    "fum_rec": 2,
    "def_st_td": 6,
    "def_td": 6,
    "safe": 2,
    "pass_yd": 0.04,
    "blk_kick": 2,
    "pass_td": 4,
    "rush_yd": 0.1,
    "fum": 0,
    "pts_allow_28_34": -1,
    "pts_allow_35p": -4,
    "fum_rec_td": 6,
    "rec_yd": 0.1,
    "def_st_ff": 1,
    "pts_allow_7_13": 4,
    "st_ff": 1
  }
}
